{
  "$schema": "https://json-schema.org/draft/2020-12/schema",
  "title": "park_admin_dashboard_summary",
  "type": "object",
  "additionalProperties": false,
  "properties": {
    "id": { "type": "string" },
    "status": { "type": "string" },
    "created_at": { "type": "string" },
    "updated_at": { "type": "string" },
    "owner_scope": { "type": "string" },
    "total_merchant_count": { "type": "number" },
    "active_merchant_count": { "type": "number" },
    "participating_merchant_count": { "type": "number" },
    "overall_redemption_rate": { "type": "number" }
  },
  "required": ["id", "status", "created_at", "updated_at", "owner_scope", "total_merchant_count", "active_merchant_count", "participating_merchant_count", "overall_redemption_rate"]
}
